product,MR_id,field-1-label-src,field-1-value,field-2-label-src,field-2-value,field-3-label-src,field-3-value,field-4-label-src,field-4-value,field-5-label-src,field-5-value
"Vintage Herman Miller Scooter Keyboard Tray Stand","MR5274","http://www.metroretrofurniture.com/images/pictures/manufac.jpg","Herman Miller","http://www.metroretrofurniture.com/images/pictures/designer.jpg","Jack Kelly 
Jack Kelley sails the Great Lakes the same way he cruises cyberspace--fast and with agility. He`s as skillful on deck as he is on line. 
""The thrill of sailing is that it puts you in communion with natural forces,"" says the erstwhile divisional winner of the Queen`s Cup and othertrans-Lake Michigan races. ""And the thrill of computers is that they put you in control of tremendous amounts of information."" 
Kelley uses his knowledge of computers as a driving force behind many of his furniture designs. 
""You have to understand computers--and the people who depend of them--to design for today`s offices,"" he says. 
Kelley does more than stay abreast of the latest technological developments. He gets out into the real work world, meeting face-to-face with the people whose lives he`s trying to make better--and more healthful. 
Kelley has been captivated by computers since 1969, when he worked at the Stanford Research Institute with Douglas Engelbart, inventor of the world`s first computer mouse. The mouse needed a pad, so Kelley designed it--the world`s first mouse pad, an invention that brought him great satisfaction and an early understanding of the complexities of working in computer environments. 
He did that work as a researcher/designer for the Herman Miller Research Corporation, headed at that time by Robert Propst, inventor of another world`s first: the Action Office system. Kelley worked side-by-side with Propst throughout the 60s and early 70s and played a pivotal role in the design of many Action Office components. 
During that time he also took up sailing, an avocation that dovetails nicely with his industrial design career. Both demand strict attention to detail, an understanding of obstacles, and a passion to overcome them. 
""I won`t tolerate anything that doesn`t work on a sailboat,"" he asserts, ""so why would I tolerate anything that doesn`t work in the office?"" 
Kelley continues to turn that intolerance into functional and attractive products. 
After more than 40 years of designing for Herman Miller, at an age when many feel awash in the tidal wave of technological advance, Jack Kelley is riding its crest.","http://www.metroretrofurniture.com/images/pictures/descript.jpg","Scooter Keyboard Stand 

Adjustable & Lightweight 
Provides comfortable & ergonomically correct keyboard & mouse support 
Versitle: used as a laptop surface, book stand, or even a lunch table! 
Sound Ergonomics 
Proper height: foot pedal adjusts the height from 22 to 30 inches 
Proper tilt: platform angle adjusts in a 20-degree range 
Ribbed footrest 
Routed grooves on the underside of the platform make it easy to grasp 
Platform accommodates oversized keyboards","http://www.metroretrofurniture.com/images/pictures/dims.jpg","28 inches Wide
min Height-22 inches
max Height-30 inches","http://www.metroretrofurniture.com/images/pictures/condit.jpg","Very Good Condition"
"Early Danish Gangso Mobler Table Dining Mid Century","MR5243","http://www.metroretrofurniture.com/images/pictures/manufac.jpg","Gangso Mobler","","null","http://www.metroretrofurniture.com/images/pictures/descript.jpg","","http://www.metroretrofurniture.com/images/pictures/dims.jpg","Length52x Depth40x Height28","http://www.metroretrofurniture.com/images/pictures/condit.jpg","Excellent"
"SOLD Vintage Stow Davis Teak Desk & Credenza Set Refinished","MR5822","http://www.metroretrofurniture.com/images/pictures/manufac.jpg","Stow Davis","http://www.metroretrofurniture.com/images/pictures/descript.jpg","Teak Desk & Credenza Set 

Teak Body 
Stainless Steel Trim & Legs 

Double Pedestal Desk 
Left: Pull-out Writing Tablet & File Drawer 
Central Drawer 
Right: Pull-out Writing Tablet & (2) Regular Storage Drawers 
Inlay Front Panel for Leg Space 

Configuration Credenza #1 
(2) Door Cabinets With Interior Shelves
(4) Regular Storage Drawers 
(1) Large File Drawer","http://www.metroretrofurniture.com/images/pictures/dims.jpg","Desk: 72"" Long x 36"" Wide x 29.5"" High","http://www.metroretrofurniture.com/images/pictures/condit.jpg","Near Excellent-Refinished","http://www.metroretrofurniture.com/images/pictures/shipp.jpg","Shipping Terms Small ItemsRecommended shipping via DHL (130 girth) or BAX Global to your doorDestination, Quantity, Dimensions, Fuel Cost and Weight of your Purchase Determine Shipping QuoteWhen buying from ebay please do not use automatic calculated shipping Large Items (or multiples)Recommended shipping via BAX Global to your doorDestination, Quantity, Dimensions, Fuel Cost and Weight of your Purchase Determine Shipping QuoteWhen buying from ebay please do not use automatic calculated shipping Alternate Shipping Large Items (or multiples)Recommended Shipping via Blanket Wrap ShippingThe buyer is responsible for making arrangements directly with the carrier. The carrier determines shipping cost and time.OrRecommended shipping via Forward Air to the terminal nearest you (Crated, shipped and insured) Customer is responsible for pick up from terminalDestination, Quantity, Dimensions, Fuel Cost and Weight of your Purchase Determine Shipping Quote Preparation, Timing and Shipment Please Allow 7 to 10 Business Days Plus Shipping Time, Shipping Varies By Location and Shipping Method Chosen.If Item needs restoration additional time will be required(Determined by item or items being refinished or reupholstered) Thank you for shopping Metro Retro Furniture for further questions please contact us at 713-473-0000"
"Mid Century Modern Italian Teak Desk","MR5662","http://www.metroretrofurniture.com/images/pictures/descript.jpg","Italian Angular Mid Century Teak Desk","http://www.metroretrofurniture.com/images/pictures/dims.jpg","59"" Length x 18"" Width x 31.25"" Height","http://www.metroretrofurniture.com/images/pictures/condit.jpg","Excellent> Refinished","http://www.metroretrofurniture.com/images/pictures/shipp.jpg","Recommended Shipping via Forward Air to the terminal nearest you for $200(Crated, shipped and insured) Customer is responsible for pick up from terminal  Alternate Shipping Large Items (or multiples)Recommended Shipping via Blanket Wrap ShippingPlease contact one of the following Blanket Wrap Shipping Companies for Shipping QuoteAce Executive Van Lines>> 925-209-0741 or email at marylou7031@comcast.netPatrick Arnold>> 803-237-5107 or email at etransporters@hotmail.comThe buyer is responsible for making arrangements directly with the carrier. The carrier determines shipping cost and time. Preparation, Timing and ShipmentPlease Allow 7 to 10 Business Days Plus Shipping Time, Shipping Varies By Location and Shipping Method Chosen.If Item needs restoration additional time will be required(Determined by item or items being refinished or reupholstered) QUOTED FOR U.S. ONLYInternational Shipping  When requesting international shipping rates, please allow Us 3 to 5 Days to Quote Thank you for shopping Metro Retro Furniture for further questions please contact us at 713-473-0000","","null"
"sold 4ft + Round Vintage Italian Walnut Dining Table~V-Shaped Tapered Legs~Under Table Stored Leaf~Extends","MR5788","http://www.metroretrofurniture.com/images/pictures/descript.jpg","4ft + Vintage Italian Walnut Dining Table","http://www.metroretrofurniture.com/images/pictures/dims.jpg","Without the Leaf> 51"" Diameter x 32"" Height","http://www.metroretrofurniture.com/images/pictures/condit.jpg","Excellent> Restored","http://www.metroretrofurniture.com/images/pictures/shipp.jpg","Crate shipping via Forward Air to the terminal nearest you OrBlanket Wrap ShippingPrice is quoted by Destination, Quantity, Dimensions and Weight of your Purchase
QUOTED FOR U.S. ONLY","","null"
"SOLD Ward Bennett Enron Lounge Chair","MR5305","http://www.metroretrofurniture.com/images/pictures/manufac.jpg","Brickel Associates","http://www.metroretrofurniture.com/images/pictures/designer.jpg","Ward Bennett
Quite simply, there is no area of art and design in which Ward Bennett has not been involved. His career evolved from his teen years onward, when he left home at thirteen and began traveling at sixteen. Travel, he says has continually been a prevailing influence on his work. Early on, he undertook various studies in the fine arts including drawing at the Porto Romano school in Florence and in Paris with Brancusi, painting in New York with Hans Hoffman and sharing space at the Clay Club with Louise Nevelson. His sculpture was exhibited at the Whitney Annual of 1944.

Best known for his interiors, Mr. Bennett`s projects include residence in New York, London, Venice and Rome, as well as his own quarter--a Manhattan apartment atop the Dakota, a country house in Long Island and a flat in Paris. In the commercial category, works encompass a national network of showrooms for Brickel, projects for Chase Manhattan Bank and consultant plans for the Solow Building Corporation. In 1963, he began a collaboration with Brickel Associates, designing first furniture and later textiles. He is considered a prodigious designer of objects: china, glassware and silver for Tiffany and Company; flatware for Supreme; porcelain for Sasaki; and, leather goods for Hermes. Bennett designs are well represented in the Museum of Modern Art`s permanent collection and in the Cooper-Hewitt Museum.

Brickel Associates became Geiger Brickel. The company was recently acquired by Herman Miller.","http://www.metroretrofurniture.com/images/pictures/descript.jpg","1970`s Ward Bennett Channel-Back Lounge Chair  Upholstery> Ruby Red Velvet Base> Wooden Posts This Lounge Chair Came From The 49th and 50th Floors of 1400 Smith Street, ENRON`s Corporate Headquarters, where the offices of the Corporate Executives included the CEO, COO and CFO This Ad is for 1 Lounge Chair","http://www.metroretrofurniture.com/images/pictures/dims.jpg","31.5"" Width x 27.5"" Depth x 31.5"" Height","http://www.metroretrofurniture.com/images/pictures/condit.jpg","Excellent Vintage"
"40"" Paul McCobb Vintage Dining Table","MR5439","","null","http://www.metroretrofurniture.com/images/pictures/designer.jpg","Paul McCobb","http://www.metroretrofurniture.com/images/pictures/descript.jpg","Paul McCobb Dining Table","http://www.metroretrofurniture.com/images/pictures/dims.jpg","Dia. 40""x Height30""","http://www.metroretrofurniture.com/images/pictures/condit.jpg","Excellent"
"Sold Scandinavian Overman Pod Swivel Leather Lounge Chair","MR5267","http://www.metroretrofurniture.com/images/pictures/manufac.jpg","Overman of Sweden","http://www.metroretrofurniture.com/images/pictures/descript.jpg","Scandinavian Overman Pod Lounge Chair 
Upholstery>Navy Blue LeatherBase> 4-Star Chrome Swivel Base  The Overman company started in Sweden. They also started a new company in Germany, Lüneburg under the same name, but their older pieces are obsolete and quite a find. This chair is extremely comfortable and elegantly designed.","http://www.metroretrofurniture.com/images/pictures/dims.jpg","30.5"" Width x 25"" Depth x 27.5"" HeightSeat Height 17""","http://www.metroretrofurniture.com/images/pictures/condit.jpg","Excellent> Reupholstered","http://www.metroretrofurniture.com/images/pictures/shipp.jpg","We recommend shipping via BAX Global for $100"
"","MR5263","","null","","null","","null","","null","","null"
"Early Edition Knoll 46 Secretarial Chair","MR5471","http://www.metroretrofurniture.com/images/pictures/manufac.jpg","Knoll","http://www.metroretrofurniture.com/images/pictures/designer.jpg","Max Pearson","http://www.metroretrofurniture.com/images/pictures/descript.jpg","Early Edition Knoll 46 Secretarial Chair","http://www.metroretrofurniture.com/images/pictures/dims.jpg","18"" Width x 18.5 Depth x 29.5- 35"" Height","http://www.metroretrofurniture.com/images/pictures/condit.jpg","Very Good Vintage"
"Silvestri Mouth Blown Glass Copper Vase","MR5075","http://www.metroretrofurniture.com/images/pictures/manufac.jpg","Silvestri","http://www.metroretrofurniture.com/images/pictures/descript.jpg","Silvestri Mouth Blown Glass VaseShimmering Iridescent GlassCopper Neck Design","http://www.metroretrofurniture.com/images/pictures/dims.jpg","11"" H x 12"" D","http://www.metroretrofurniture.com/images/pictures/condit.jpg","Very Good","http://www.metroretrofurniture.com/images/pictures/shipp.jpg","We recommend shipping via DHLDouble Boxed for $30
QUOTED FOR U.S. ONLY"
"sold Milo Baughman Thayer-Coggin Lounge Chair","MR5423","http://www.metroretrofurniture.com/images/pictures/manufac.jpg","Thayer-Coggins","http://www.metroretrofurniture.com/images/pictures/designer.jpg","Milo Baughman","http://www.metroretrofurniture.com/images/pictures/descript.jpg","Milo Baughman Thayer-Coggin Lounge Chair 1970`s Design Upholstery> Brown VinylBase> Chrome Base This Ad is for 1 Chair Identical piece can be seen on 1stdibs.com","http://www.metroretrofurniture.com/images/pictures/dims.jpg","33"" Width x 33"" Depth x 31"" Height","http://www.metroretrofurniture.com/images/pictures/condit.jpg","Very Good Tear on the back of the chair and one button missing"
"Bang & Olufsen Beocord 5000 Stereo Cassette Recorder SOLD","MR5568","http://www.metroretrofurniture.com/images/pictures/manufac.jpg","Bang & Olufsen","http://www.metroretrofurniture.com/images/pictures/designer.jpg","Jacob Jensen","http://www.metroretrofurniture.com/images/pictures/descript.jpg","Beocord 5000 Cassette Recorder 

1984 - 1987 

A top-quality cassette recorder, perfectly matched to Beomaster 5000 as part of Beosystem 5000. 
When the two units were used together the cassette deck could be operated entirely by remote control. 

Very Advanced Design! 

For the home recording enthusiast it offers superb standards of sound quality & precision engineering 

Bang & Olufsen`s patented HX PRO recording system, Dolby B & C Noise Reduction & a 6-layer Canon combination head with a 1.8mm gap all contributes to a recording & playback performance that delighted even the most exacting technician. 

Beocord 5000 represents a supremely straightforward way of making high-quality recordings & subsequently enjoying them in relaxing comfort 

Features: 
-START/GO function that rewinds the tape to its beginning & plays it without further instruction 
-Automatic ADVANCE function (tape search) that finds the start of any required track from either end of the tape 
-Auto Record level 

You can switch instantly from one tape transport mode to another 

The cassette tray & direct operation controls were housed in a motor-driven drawer which opened & closed at a touch. 
When used with Beomaster 5000, Beocord 5000 could, of course, be programmed to record or play automatically at any set time. 

Connections: stereo microphone (DIN); Aux input DIN; data-link to Beomaster 5000 (one socket, 3-way switchable) 

Beocord 5000 Technical Specifications 

Other Bang & Olufsen Pieces Available 
Including Other Pieces from The Beosystem 5000 Family-All Sold Separately","http://www.metroretrofurniture.com/images/pictures/condit.jpg","Good Working Condition 
Presently running & installed; will be removed upon purchase","http://www.metroretrofurniture.com/images/pictures/shipp.jpg","We recommend shipping via DHL"
"32"" Wide Large Danish Lounge Recliner Pull Out Ottoman","MR5879","http://www.metroretrofurniture.com/images/pictures/descript.jpg","Danish Lounge Chair Recliner 

Oversized Design 

Slat wood frame 
Curved Arms 
Tapered Legs 
Upholstered in New Merlot Red Leather","http://www.metroretrofurniture.com/images/pictures/dims.jpg","32"" Wide x 35"" Deep x 38"" High 
Seat Height-16""","http://www.metroretrofurniture.com/images/pictures/condit.jpg","Very Good Condition 
New Cushions & Leather!","http://www.metroretrofurniture.com/images/pictures/shipp.jpg","We recommend crate shipping via ForwardAir to the terminal nearest you.
QUOTED FOR U.S. ONLY","","null"
"Modern Scandinavian Ceiling Lamp Eames Era","MR5365","","null","","null","","null","","null","","null"
"sold Oriental Black Lacquer Demi-Lune Console Table","MR5953","http://www.metroretrofurniture.com/images/pictures/descript.jpg","Oriental Elmwood Entry Table","http://www.metroretrofurniture.com/images/pictures/dims.jpg","36"" Length x 18"" Width x 38.75"" Height","http://www.metroretrofurniture.com/images/pictures/condit.jpg","Very Good Vintage","http://www.metroretrofurniture.com/images/pictures/shipp.jpg","We recommend shipping via BAX Global for $110","","null"
"sold Arts and Craft Drop Leaf Dining Table","MR5425","http://www.metroretrofurniture.com/images/pictures/descript.jpg","5`-8.5` Arts and Craft Drop Leaf Dining Table","http://www.metroretrofurniture.com/images/pictures/dims.jpg","63.25"" Lenght x 35.5"" Width x 28.5"" Height","http://www.metroretrofurniture.com/images/pictures/condit.jpg","Excellent> Refinished","http://www.metroretrofurniture.com/images/pictures/shipp.jpg","We recommend crate shipping via ForwardAir to the terminal nearest you $200 or Blanket Wrap Shipping 
QUOTED FOR U.S. ONLY","","null"
"Vintage Danish Style Wood Corner Hutch","MR5888","http://www.metroretrofurniture.com/images/pictures/descript.jpg","Vintage Danish Style Corner Hutch","http://www.metroretrofurniture.com/images/pictures/dims.jpg","25"" Length x 17"" Width x 78"" Height","http://www.metroretrofurniture.com/images/pictures/condit.jpg","Excellent","http://www.metroretrofurniture.com/images/pictures/shipp.jpg","We recommend crate shipping via ForwardAir to the terminal nearest you for $200
QUOTED FOR U.S. ONLY","","null"
"SOLD 4` Vintage Walnut Bar Cabinet","MR5540","http://www.metroretrofurniture.com/images/pictures/descript.jpg","4` Vintage Walnut Bar Cabinet This Three Level Bar Cabinet has Several Great FeaturesSolid WalnutTop Opens and Adjusts to 5 Levels Deep Storage CabinetsBronze Handle Pulls This Cabinet is Great for Any Room, Den, Bar, Dining- Even your Office","http://www.metroretrofurniture.com/images/pictures/dims.jpg","21"" Length x 16.75"" Width x 48.5"" Height","http://www.metroretrofurniture.com/images/pictures/condit.jpg","Excellent","http://www.metroretrofurniture.com/images/pictures/shipp.jpg","We recommend crate shipping via ForwardAir to the terminal nearest you for $200
QUOTED FOR U.S. ONLY","","null"
"3.5ft Vintage Wood Cabinet Bookcase","MR5905","http://www.metroretrofurniture.com/images/pictures/descript.jpg","3.5ft Vintage Cabinet Bookcase Wood Bookcase Interior ShelvesPanel Legs This Would Be A Great Activity Center for Those Modern Gadgets Such As Xbox, Play station, Favorite DVDs, TV, Etc.","http://www.metroretrofurniture.com/images/pictures/dims.jpg","Exterior> 34"" Length x 17.25"" Width x 43"" HeightInterior> 29"" Length x 14"" Width x 33"" Height","http://www.metroretrofurniture.com/images/pictures/condit.jpg","Very Good Vintage Age Appropriate Wear","http://www.metroretrofurniture.com/images/pictures/shipp.jpg","Shipping Options Large Items (or multiples) BLANKET WRAP DELIVERY SERVICEPlease contact us for a licensed Blanket Wrap Shipping delivery service with in house deliveries. States that are serviced are, New York, New Jersey, Connecticut, Massachusetts, Pennsylvania, Maryland, Washington DC, Virginia, Tennessee, Arkansas, Texas, and Louisiana.Prices are listed per Item determined by weight and dimensions prices subject to change.Bookcases $325-$475Club/Lounge Chairs $125-$175Coffee Tables $125-$175Desks/Credenzas $325-$475Dining Size Chairs $65Dining Tables $375-$475Loveseats/Settees $225-$275Sofas $235-$425Multiple Items are discounted to same locationAdditional charges may occur such as Stairs, Glass or Marble items etc.The buyer is responsible for making arrangements directly with the carrier. The carrier determines shipping cost and delivery time.BLANKET WRAP PAYMENTS GO DIRECTLY TO SHIPPING COMPANYOrFORWARD AIR to the terminal nearest you $150(Crated, shipped and insured) Customer is responsible for pick up from terminalFORWARD AIR PAYMENTS GO DIRECTLY TO METRO RETRO ALTERNATE SHIPPING OPTIONS Please call or email for shipping quote Fed Ex, US Mail, Freightquote.com (for best shipping price) Determined by Destination, Quantity, Dimensions, Fuel Cost and Weight of your Purchase Determines Shipping QuotePreparation, Timing and ShipmentPlease Allow 7 to 10 Business Days Plus Shipping Time, Shipping Varies By Location and Shipping Method Chosen.If Item needs restoration additional time will be required(Determined by item or items being refinished or reupholstered) QUOTED FOR U.S. ONLYInternational Shipping  When requesting international shipping rates, please allow Us 3 to 5 Days to QuoteThank you for shopping Metro Retro Furniture for further questions please contact us at 713-473-0000","","null"
"","MR5445","","null","","null","","null","","null","","null"
"Memphis/ Du Pasquier/ Sottsass/ Lamp","MR5398","","null","","null","","null","","null","","null"
"Blickman One Drawer Stainless Steel Cart Work Table","MR5847","http://www.metroretrofurniture.com/images/pictures/manufac.jpg","Blickman","","null","http://www.metroretrofurniture.com/images/pictures/descript.jpg","UTILITY TABLES","http://www.metroretrofurniture.com/images/pictures/dims.jpg","21"" Length X 17 1/4"" Width X 36 3/4"" Height","http://www.metroretrofurniture.com/images/pictures/condit.jpg","Very Good"
"Stacking Kart Multi-purpose Office Chair Enron by Vecta","MR5895","http://www.metroretrofurniture.com/images/pictures/manufac.jpg","VECTA","http://www.metroretrofurniture.com/images/pictures/descript.jpg","Kart chair by Vecta with arms, hard back and upholstered black seatWith its refined styling, patented four-star base, pneumatic height adjustment, and adjustable back tension, the Kart chair is the ultimate in style and performance.Comfortable and stable enough to be used all day as an office worker’s main chair, a flip of the seat allows eight chairs to nest in the space of two and a half. This eases the storage requirements of the facilities manager who must flexibly arrange corporate training rooms and meeting halls, and provides a better environment for gatherings like classes, seminars and conventions. This ad is for the black upholstered seat only; we also have green seat, yellow seat and orange seat available.","http://www.metroretrofurniture.com/images/pictures/dims.jpg","Length 24.75"" x Width 22"" x Height 32.75""Seat Height 17"" Highest Height 37"" Lowest Height 32.75""","http://www.metroretrofurniture.com/images/pictures/condit.jpg","Very Good","http://www.metroretrofurniture.com/images/pictures/shipp.jpg","We recommend shipping via BAX Global for $85 per chair
QUOTED FOR U.S. ONLY"
"","MR5726","","null","","null","","null","","null","","null"
"46"" Industrial Age Royal Metal Settee Sofa Couch","MR5875","http://www.metroretrofurniture.com/images/pictures/manufac.jpg","Royal Metal Manufacturer Co.","","null","http://www.metroretrofurniture.com/images/pictures/descript.jpg","Vintage Royal Metal Settee","http://www.metroretrofurniture.com/images/pictures/dims.jpg","46"" Length x 33"" Width x 33 1/2"" Height","http://www.metroretrofurniture.com/images/pictures/condit.jpg","Very good vintage condition"
"","MR5939","","null","","null","","null","","null","","null"
"sold Vintage Gawet Vermont Granite Balance Scientific Table Black Granite Rounded Edges","MR5238","http://www.metroretrofurniture.com/images/pictures/manufac.jpg","Gawet Marble & Granite, Inc.","http://www.metroretrofurniture.com/images/pictures/descript.jpg","Vermont Granite Balance Table 

Features:","http://www.metroretrofurniture.com/images/pictures/dims.jpg","35"" Width x 24"" Depth x 31"" Height","http://www.metroretrofurniture.com/images/pictures/condit.jpg","Overall Very Good Condition
there is a chip in the granite in the bottom corner (shown above)","http://www.metroretrofurniture.com/images/pictures/shipp.jpg","Shipping Terms Small ItemsRecommended shipping via DHL (130 girth) or BAX Global to your doorDestination, Quantity, Dimensions, Fuel Cost and Weight of your Purchase Determine Shipping QuoteWhen buying from ebay please do not use automatic calculated shipping Large Items (or multiples)Recommended shipping via BAX Global to your doorDestination, Quantity, Dimensions, Fuel Cost and Weight of your Purchase Determine Shipping QuoteWhen buying from ebay please do not use automatic calculated shipping Alternate Shipping Large Items (or multiples)Recommended Shipping via Blanket Wrap ShippingThe buyer is responsible for making arrangements directly with the carrier. The carrier determines shipping cost and time.OrRecommended shipping via Forward Air to the terminal nearest you (Crated, shipped and insured) Customer is responsible for pick up from terminalDestination, Quantity, Dimensions, Fuel Cost and Weight of your Purchase Determine Shipping Quote Preparation, Timing and Shipment Please Allow 7 to 10 Business Days Plus Shipping Time, Shipping Varies By Location and Shipping Method Chosen.If Item needs restoration additional time will be required(Determined by item or items being refinished or reupholstered)  Thank you for shopping Metro Retro Furniture for further questions please contact us at 713-473-0000"
