product,MR_id,field-1-label-src,field-1-value,field-2-label-src,field-2-value,field-3-label-src,field-3-value,field-4-label-src,field-4-value,field-5-label-src,field-5-value
"","MR4254","","null","","null","","null","","null","","null"
"soldKittinger Mueller Barringer Gold Leaf  Table","MR4316","http://www.metroretrofurniture.com/cgi-bin/%60http://www.metroretrofurniture.com/images/manu.gif%60","null","http://www.metroretrofurniture.com/cgi-bin/%60http://www.metroretrofurniture.com/images/desc.gif%60","null","http://www.metroretrofurniture.com/cgi-bin/%60http://www.metroretrofurniture.com/images/dimen.gif%60","null","http://www.metroretrofurniture.com/cgi-bin/%60http://www.metroretrofurniture.com/images/ship.gif%60","null","http://www.metroretrofurniture.com/cgi-bin/%60http://www.metroretrofurniture.com/images/cond.gif%60","null"
"George III Square Mahogany Burl Dining Table SOLD","MR4518","http://www.metroretrofurniture.com/images/pictures/descript.jpg","Mahogany Burl Dining Table 
George III Style 

Mahogany; star burst burl pattern top 
Carved three-star pedestal base 
Features casters with bronze feet 

We have four of these tables available; Price Per Table","http://www.metroretrofurniture.com/images/pictures/dims.jpg","42"" Wide x 42"" Deep x 30"" High","http://www.metroretrofurniture.com/images/pictures/condit.jpg","Very Good Condition-Refinished","http://www.metroretrofurniture.com/images/pictures/shipp.jpg","We recommend crate shipping via ForwardAir to the terminal nearest you for $150
QUOTED FOR U.S. ONLY","","null"
"Signed Metal & Wood Carved Figurative Wall Sculpture","MR4903","http://www.metroretrofurniture.com/images/pictures/descript.jpg","Grid Wall Sculpture 

Shadow box figures 

Frame onstructed of wood 
Features six boxes with carved wood figures 
Figures have outstretched metal arms 

Signed Jose Alves de Olinda","http://www.metroretrofurniture.com/images/pictures/dims.jpg","10"" x 5.5"" x .75"" d","http://www.metroretrofurniture.com/images/pictures/condit.jpg","Very Good Condition","http://www.metroretrofurniture.com/images/pictures/shipp.jpg","We recommend shipping via DHL","","null"
"Recovered Florence Knoll Club Chair Tubular Steel Base","MR4605","http://www.metroretrofurniture.com/images/desc.gif","null","","null","","null","","null","","null"
"(1) Original Knoll Bertoia Cushion Full Cover Red","MR4267","http://www.metroretrofurniture.com/images/pictures/manufac.jpg","Knoll International","http://www.metroretrofurniture.com/images/pictures/designer.jpg","Harry Bertoia
Italian artist and furniture designer, Harry Bertoia`s career began in the 1930s as a student at the Cranbrook Academy of Art where he re-established the metal-working studio and, taught as head of the department, from 1939 until 1943 until it was closed due to wartime restrictions on materials. During the war, Bertoia worked with Charles and Ray Eames at the Evans Products Company in California, developing new techniques for molding plywood. 
Bertoia designed the patented Diamond chair for Knoll in 1952. As a furniture designer, Bertoia is best known for the Diamond chair and the Bird chair, a high-backed model developed from the Diamond chair that looks like a bird with spread wings. Its organic, human-friendly form helped to create a new look for modernism. All of his work bears the hallmarks of a highly skilled and imaginative sculptor, as well as an inventive designer, deeply engaged with the relationship between form and space. 
Harry Bertoia received awards from the American Institute of Architects in 1973 and the American Academy of Letters in 1975.","http://www.metroretrofurniture.com/images/pictures/descript.jpg","(1) Vintage Knoll Bertoia Full Cover for Side Chair Red vinyl original full cover stretches over the wire seat basket, tightly with draw-string and secured with hooks. 

Price per (1) cover; multiple availableCHAIR SOLD SEPARATELYClick Here For Original Knoll Harry Bertoia Side Chair Black","http://www.metroretrofurniture.com/images/pictures/dims.jpg","Fits a regular side chair 21.75"" Width x 19.75"" Depth","http://www.metroretrofurniture.com/images/pictures/condit.jpg","Very Good Vintage Minor ware in the upholstery along edges"
"","MR4859","","null","","null","","null","","null","","null"
"Vintage 21"" Round Glass Coffee Table Bronze Base","MR4131","","null","","null","","null","","null","","null"
"Pair of Vintage Futorian Stratford Walnut Lounge Chair","MR4354","http://www.metroretrofurniture.com/images/manu.gif","null","http://www.metroretrofurniture.com/images/desc.gif","null","http://www.metroretrofurniture.com/images/dimen.gif","null","http://www.metroretrofurniture.com/images/ship.gif","null","http://www.metroretrofurniture.com/images/cond.gif","null"
"Herman Miller Eames Rosewood Lounge & Ottoman","MR4106","","null","","null","","null","","null","","null"
"Milo Baughman for Directional - Recovered","MR4438","http://www.metroretrofurniture.com/images/manu.gif","null","http://www.metroretrofurniture.com/images/desi.gif","null","http://www.metroretrofurniture.com/images/desc.gif","null","http://www.metroretrofurniture.com/images/dimen.gif","null","http://www.metroretrofurniture.com/images/ship.gif","null"
"George Nelson Mid Century Mahogany Low Tables","MR4971","http://www.metroretrofurniture.com/images/pictures/manufac.jpg","Herman Miller","http://www.metroretrofurniture.com/images/pictures/designer.jpg","George Nelson (1908-1986) was an important modernist whose work cut across the fields of interior, industrial and exhibition design. Nelson studied architecture at Yale University in the 1920s, and in the next two decades earned a strong reputation as a writer on design for Architectural Forum, Interiors and Fortune. In 1945 Nelson began a long association with the Herman Miller Furniture Company of Zeeland, Michigan, where as head designer he developed an innovative line of furniture and commissioned new designs from others. His first commission was Isamu Noguchi`s biomorphic glass-topped coffee table, which began production in 1947, the first of many designs that the sculptor would create for Herman Miller in the late Forties. Nelson also was responsible for bringing the designs of Charles Eames to Herman Miller. projects. Among Nelson`s own creations are classic works of Fifties design, including the bubble lamp, ball clock, marshmallow sofa and the pole-supported wall-storage system.","http://www.metroretrofurniture.com/images/pictures/descript.jpg","","http://www.metroretrofurniture.com/images/pictures/dims.jpg","1st End Table: L28x D16x H24.25","http://www.metroretrofurniture.com/images/pictures/condit.jpg","Excellent"
"Sophisticate 60`s Tomlinson Oak End Tables","MR4993","http://www.metroretrofurniture.com/images/pictures/manufac.jpg","Tomlinson","http://www.metroretrofurniture.com/images/pictures/descript.jpg","Sophisticate 60`s Oak End Tables","http://www.metroretrofurniture.com/images/pictures/dims.jpg","28"" L x 24"" W x 19"" H","http://www.metroretrofurniture.com/images/pictures/condit.jpg","Very good Vintage","http://www.metroretrofurniture.com/images/pictures/shipp.jpg","We recommend shipping via DHL for $50"
"Vintage Paul McCobb Calcata Marble Low Table","MR4128","","null","","null","","null","","null","","null"
"Vintage World War Military File Cabinet WWII Barrister","MR4846","","null","","null","","null","","null","","null"
"sold Mid Century Modern Dixie Chest Drawers Dresser Bedroom","MR4778","","null","","null","","null","","null","","null"
"","MR4194","","null","","null","","null","","null","","null"
"Antique Architectural Adjustable Drafting Light Table","MR4916","","null","","null","","null","","null","","null"
"SOLD 5ft Laverne Keck & Keck Carerra Italian Marble Table","MR4880","http://www.metroretrofurniture.com/images/pictures/manufac.jpg","Laverne","http://www.metroretrofurniture.com/images/pictures/descript.jpg","This Laverne carrera marble Italian table is from Hy Hammer`s Keck and Keck Estate. Above is pictured of the table in the estate from which it was acquired (1952-1953).","http://www.metroretrofurniture.com/images/pictures/dims.jpg","60""L x 22""W x 13.5""H","http://www.metroretrofurniture.com/images/pictures/condit.jpg","Mint","http://www.metroretrofurniture.com/images/pictures/shipp.jpg","We recommend crate shipping via ForwardAir to a terminal nearest you for $250"
"6ft Vintage Dark Walnut Stow Davis Modern Credenza","MR4424","http://www.metroretrofurniture.com/images/pictures/manufac.jpg","Stow Davis Started manufacturing furniture in 1880 in Grand Rapids MI. In 1985 Steelcase bought Stow Davis.","http://www.metroretrofurniture.com/images/pictures/descript.jpg","6ft Vintage Stow Davis Credenza Dark walnut credenza with eight drawers. The four bottom drawers were designed for filing and the four top drawers are great for every day storage. The drawer pulls are polished aluminum. The chrome legs wrap around the sides and then capped with a beautiful dark walnut panel.This ad is for (1) credenza; Other credenzas available click here","http://www.metroretrofurniture.com/images/pictures/dims.jpg","78.75"" Length x 24"" Depth x 29"" Height","http://www.metroretrofurniture.com/images/pictures/condit.jpg","Excellent>Refinished","http://www.metroretrofurniture.com/images/pictures/shipp.jpg","FORWARD AIR to the terminal nearest you $200(Crated, shipped and insured) Customer is responsible for pick up from terminalFORWARD AIR PAYMENTS GO DIRECTLY TO METRO RETROClick here for other shipping options   Preparation, Timing and ShipmentPlease Allow 7 to 10 Business Days Plus Shipping Time, Shipping Varies By Location and Shipping Method Chosen.If Item needs restoration additional time will be required(Determined by item or items being refinished or reupholstered) International Shipping  When requesting international shipping rates, please allow Us 3 to 5 Days to QuoteThank you for shopping Metro Retro Furniture for further questions please contact us at 713-473-0000QUOTED FOR 48 U.S. STATES ONLY"
"Set of Jens Risom Howe Desk,Credenza & Low Table","MR4537","http://www.metroretrofurniture.com/images/pictures/manufac.jpg","Howe","http://www.metroretrofurniture.com/images/pictures/designer.jpg","Jens Risom

Jens Risom emigrated from Europe to the U.S. when he was just 23 years of age. Like other Scandinavian designers such as Josef Frank and Kaare Klint, Risom continued to honor tradition in modern design, combining old and new in highly original ways. 

Jens Risom`s career has spanned nearly sixty years. He began his study of design in the Copehagen workshop of Kaare Klint in 1935 and joined Ernst Kuhn`s architectural office in 1938, where he designed furniture and interiors. In 1939, Risom emigrated to the U.S. and in 1941 designed the first chair manufactured by Knoll. Risom described the chair as ""very basic, very simple, inexpensive, easy to make."" The chair was constructed with a birch wood frame and, because of wartime materials constraints, cheap but strong army surplus webbing and has inspired countless imitations. 

Risom continued to create simple, well-crafted modern furniture with Knoll and George Jensen, but established his own design studio, Jens Risom Design, in 1946. The studio was acquired by Dictaphone in 1970 and in 1973, Risom became chief executive of Design Control, a Connecticut based design consultancy. 

In the 1970`s, he acted as a trustee of the Rhode Island School of design. Now in his eighties, Jens Risom continues to be active and his work continues to reflect the Danish approach to modernism, with its emphasis on traditional values and the human need for warmth, beauty and simplicity. Modern American design owes much to his unfailing sense of proportion, commitment to practicality and insight into the forms of modern living.","http://www.metroretrofurniture.com/images/pictures/descript.jpg","Set of Jens Risom Howe Desk, Credenza & Low Table
This is for a set of four Howe Jens Risom pieces 

~Set Features~ 
Chrome legs in oak wood

DESK 
(2) Standard drawers and (1) file drawer 

LOW TABLE 
Small hanging shelf underneath 

CREDENZA 
(4) Standard drawers 

A great set for the modern home or office 

PRICE IS FOR THE SET 
Pieces can be sold seperately if interested in individual pieces, you may contact us with any questions","http://www.metroretrofurniture.com/images/pictures/dims.jpg","Low Table: 2ft Square x 18"" Height - Interior shelf: 14.5"" Width x 18"" Depth","http://www.metroretrofurniture.com/images/pictures/condit.jpg","Very Good Vintage Condition"
"6Ft Helikon Marble Chrome Oval Conference Dining Table","MR4545","http://www.metroretrofurniture.com/images/pictures/descript.jpg","HELIKON DINING TABLEGreen & white veining marble oval shape table topMirrored tubular polished chrome base","http://www.metroretrofurniture.com/images/pictures/dims.jpg","77"" Length X  48"" Width X 29"" Height","http://www.metroretrofurniture.com/images/pictures/condit.jpg","Very Good Vintage","http://www.metroretrofurniture.com/images/pictures/shipp.jpg","We recommend Blanket Wrap Shipping","","null"
"Vintage Harter Scope Couch Teal Leather Steel 3 Seater","MR4590","http://www.metroretrofurniture.com/images/pictures/manufac.jpg","Harter","http://www.metroretrofurniture.com/images/pictures/designer.jpg","Evan Harter established the Harter company in 1927 as a high quality resource for a range of mid-West companies who lacked expertise in the manufacture of seating. After years during which Harter sharpened its competence in the design, engineering and manufacture of chairs, Harter made the decision to market a ""posture back secretarial chair"" under its own name. 

This one product provided the springboard to development of a business that flourished through the 50`s, 60`s, 70`s and 80`s. During this time, Harter developed a reputation for producing precision built, durable and aesthetically pleasing chairs that appealed to both end users and the architectural & design community.","http://www.metroretrofurniture.com/images/pictures/descript.jpg","Vintage Harter Scope Couch Teal Leather Steel 3 Seater 

~Features~ 
This auction is for a vintage Harter Scope sofa 
The three seat sofa is upholstered in teal leather and the base square high polished steel 

A very stylish addition to any space and great for the collector of midcentury modern furniture","http://www.metroretrofurniture.com/images/pictures/dims.jpg","66"" Length X 24"" Depth X 31"" Height 
Seat Height 16""","http://www.metroretrofurniture.com/images/pictures/condit.jpg","Very good vintage condition 
Age appropriate wear"
"Knoll Stephens Lounge Chair Chocolate Moleskin Velour","MR4421","http://www.metroretrofurniture.com/images/manu.gif","null","http://www.metroretrofurniture.com/images/desi.gif","null","http://www.metroretrofurniture.com/images/desc.gif","null","http://www.metroretrofurniture.com/images/dimen.gif","null","http://www.metroretrofurniture.com/images/ship.gif","null"
"Mid Century Modern Knoll Saarinen Chair Lounge Seating","MR4750","","null","","null","","null","","null","","null"
"Modern Retro Chic Kitsch Table Seat Chair Seating","MR4755","","null","","null","","null","","null","","null"
"Vintage Florence Knoll Oak Conference Dining Table","MR4004","","null","","null","","null","","null","","null"
"Mid Century Mcintosh Danish Teak Breakfront Dining","MR4766","","null","","null","","null","","null","","null"
"","MR4757","","null","","null","","null","","null","","null"
"Conant Ball Russel Wright Maple Dining Set","MR4641","http://www.metroretrofurniture.com/images/pictures/manufac.jpg","Conant Ball","http://www.metroretrofurniture.com/images/pictures/designer.jpg","Russel Wright

Russel Wright first began at the age of 30 to design 60 pieces of furniture for Heywood-Wakefield Furniture Company. These items were sold at Bloomingdale`s and were marketed with rugs, curtains, lamps and accessories all designed by Russel Wright. This was 1934 and marked the first offering of coordinated mass produced home furnishings ever created by 1 designer. 

In 1935 Russel Wright contracted with Conant Ball Company to produce American Modern. A solid maple line of furniture, it was an instant hit. It was offered in 2 finishes, a natural unstained finish Russel and Mary dubbed blonde and a reddish stained maple. This line was the first solid maple, blonde finished furniture of modern design ever to be produced. 

A vice president of Macy`s said in 1938, that this line was the most successful ever carried by Macy`s, whether traditional or modern.","http://www.metroretrofurniture.com/images/pictures/descript.jpg","Russel Wright Dining Set Conant Ball 1852 
Solid maple construction 

4 Modernmates -7403 Chairs 
Seats upholstered in red fabric 
Tapered legs 

American Modern Line: 
Drop-leaf table 
Conant Ball brand and numbers 6009, 3553 stamped underneath","http://www.metroretrofurniture.com/images/pictures/dims.jpg","Table-66""L x 42""W x 30""H; collapsed 24"" x 42"" 
Chairs- 17.5""W x 16""D x 30""H; seat height 17.5""","http://www.metroretrofurniture.com/images/pictures/condit.jpg","Very good vintage, age appropriate wear"
"Henredon Knee Hole Credenza Burl Wood Metal Handles","MR4322","http://www.metroretrofurniture.com/images/desc.gif","null","http://www.metroretrofurniture.com/images/dimen.gif","null","http://www.metroretrofurniture.com/images/ship.gif","null","http://www.metroretrofurniture.com/images/cond.gif","null","","null"
"6ft Knoll Round Maple Conference Dining Table 4 Star Polished Chrome Base","MR4235","http://www.metroretrofurniture.com/images/pictures/manufac.jpg","Knoll International","http://www.metroretrofurniture.com/images/pictures/designer.jpg","Florence Knoll
Trained as an architect, Florence Knoll`s own pieces for Knoll are simple, architectural designs that stand the test of time. Her lounge seating, sofas, tables, and storage adapt flawlessly to any environment, with their clean, linear design and incredibly durable, high-quality construction. These pieces are built to last a lifetime - or several lifetimes. Not flashy pieces at all, Knoll said that her own work ""filled in the gaps"" for star pieces by Bertoia and Saarinen, but today we know that they stand in a class all by themselves.","http://www.metroretrofurniture.com/images/pictures/descript.jpg","6ft Knoll Round Maple Conference Table","http://www.metroretrofurniture.com/images/pictures/dims.jpg","72"" Diameter x 29"" Height","http://www.metroretrofurniture.com/images/pictures/condit.jpg","Very Good Vintage"
"Steelcase Walnut Wood Vintage L-Shape Desk Office","MR4552","http://www.metroretrofurniture.com/images/manu.gif","null","http://www.metroretrofurniture.com/images/desc.gif","null","http://www.metroretrofurniture.com/images/dimen.gif","null","http://www.metroretrofurniture.com/images/ship.gif","null","http://www.metroretrofurniture.com/images/cond.gif","null"
"Jens Risom Crotch Walnut Credenza & Desk Set","MR4110","","null","","null","","null","","null","","null"
"Vintage Florence Knoll Marble Chrome Low Table","MR4531","http://www.metroretrofurniture.com/images/manu.gif","null","http://www.metroretrofurniture.com/images/desi.gif","null","http://www.metroretrofurniture.com/images/desc.gif","null","http://www.metroretrofurniture.com/images/cond.gif","null","","null"
"Metz Contempora Multi-Functional Burl Bench Low Table","MR4670","http://www.metroretrofurniture.com/images/desc.gif","null","http://www.metroretrofurniture.com/images/ship.gif","null","","null","","null","","null"
"2 Herman Miller Eames Leather Soft Pad Side Chairs","MR4989","http://www.metroretrofurniture.com/images/pictures/manufac.jpg","Herman Miller","http://www.metroretrofurniture.com/images/pictures/descript.jpg","Pair of Soft Pad Side Chairs","http://www.metroretrofurniture.com/images/pictures/dims.jpg","23""W x 16.5""D x 34""H","http://www.metroretrofurniture.com/images/pictures/condit.jpg","Both in Good Vintage Condition","http://www.metroretrofurniture.com/images/pictures/shipp.jpg","We recommend flat rate shipping via UPS for $130 for the pair."
"","MR4453","","null","","null","","null","","null","","null"
"Stow Davis Dark Walnut Knee Hole Credenza Midcentury PRICE REDUCED","MR4466","http://www.metroretrofurniture.com/images/manu.gif","null","http://www.metroretrofurniture.com/images/desc.gif","null","http://www.metroretrofurniture.com/images/dimen.gif","null","http://www.metroretrofurniture.com/images/ship.gif","null","http://www.metroretrofurniture.com/images/cond.gif","null"
"Vintage Plywood Drafting Stool","MR4285","http://www.metroretrofurniture.com/images/desc.gif","null","http://www.metroretrofurniture.com/images/dimen.gif","null","http://www.metroretrofurniture.com/images/ship.gif","null","http://www.metroretrofurniture.com/images/cond.gif","null","","null"
"6ft Contemporary Modern Walnut Floating Sideboard Ebonized Base","MR4637","http://www.metroretrofurniture.com/images/pictures/descript.jpg","6ft Vintage Walnut Credenza Breakfront

~Features~
Walnut Finish with Black Fiberglass Base 
(2) File Drawers","http://www.metroretrofurniture.com/images/pictures/dims.jpg","72"" (6ft) Length X 19"" Depth X 29"" Height","http://www.metroretrofurniture.com/images/pictures/condit.jpg","Very Good Vintage","http://www.metroretrofurniture.com/images/pictures/shipp.jpg","null","","null"
"Herman Miller Burdick Group Marble Desk 10ft","MR4325","http://www.metroretrofurniture.com/cgi-bin/%60http://www.metroretrofurniture.com/images/manu.gif%60","null","http://www.metroretrofurniture.com/cgi-bin/%60http://www.metroretrofurniture.com/images/desi.gif%60","null","http://www.metroretrofurniture.com/cgi-bin/%60http://www.metroretrofurniture.com/images/desc.gif%60","null","http://www.metroretrofurniture.com/cgi-bin/%60http://www.metroretrofurniture.com/images/dimen.gif%60","null","http://www.metroretrofurniture.com/cgi-bin/%60http://www.metroretrofurniture.com/images/ship.gif%60","null"
"Mid Century Modern Knoll Zapf Chair Tweed Fabric","MR4430","http://www.metroretrofurniture.com/images/pictures/manufac.jpg","Knoll International","http://www.metroretrofurniture.com/images/pictures/designer.jpg","Otto Zapf
(1931- )
Birthplace: Rossbach, CSSR","http://www.metroretrofurniture.com/images/pictures/descript.jpg","Knoll Advanced Low Back Executive Chair
Swivels, tilts and rolls on casters
Four star base
Tan checkered upholstered pattern with cushioned arms 
 
~Four Executive Chairs available, Price per unit~","http://www.metroretrofurniture.com/images/pictures/dims.jpg","21"" Width x 28"" Depth x 36"" Height
Seat Height 22""","http://www.metroretrofurniture.com/images/pictures/condit.jpg","Very Good Vintage
Age Appropriate Wear"
"Walnut Matching Desk and Credenza Set Chrome Vintage","MR4582","http://www.metroretrofurniture.com/images/desc.gif","null","http://www.metroretrofurniture.com/images/dimen.gif","null","http://www.metroretrofurniture.com/images/ship.gif","null","http://www.metroretrofurniture.com/images/cond.gif","null","","null"
"Heywood Wakefield M782 Utility Cabinet","MR4162","","null","","null","","null","","null","","null"
"Pair of Dunbar Armchairs Flower Embroidered Wood Modern","MR4229","http://www.metroretrofurniture.com/images/manu.gif","null","http://www.metroretrofurniture.com/images/desi.gif","null","http://www.metroretrofurniture.com/images/desc.gif","null","http://www.metroretrofurniture.com/images/dimen.gif","null","http://www.metroretrofurniture.com/images/ship.gif","null"
"24"" Pair (2) Florence Knoll Oak Chrome Coffee Tables","MR4953","http://www.metroretrofurniture.com/images/pictures/manufac.jpg","Knoll International","http://www.metroretrofurniture.com/images/pictures/designer.jpg","Florence Knoll

Trained as an architect, Florence Knoll`s own pieces for Knoll are simple, architectural designs that stand the test of time. Her lounge seating, sofas, tables, and storage adapt flawlessly to any environment, with their clean, linear design and incredibly durable, high-quality construction. These pieces are built to last a lifetime - or several lifetimes. Not flashy pieces at all, Knoll said that her own work ""filled in the gaps"" for star pieces by Bertoia and Saarinen, but today we know that they stand in a class all by themselves.","http://www.metroretrofurniture.com/images/pictures/descript.jpg","Florence Knoll","http://www.metroretrofurniture.com/images/pictures/dims.jpg","23.5""L x 23.5""W x 17""H","http://www.metroretrofurniture.com/images/pictures/condit.jpg","Excellent Condition"
"IIL Teak Marble Top Credenza Chrome Handles Midcentury","MR4465","http://www.metroretrofurniture.com/images/manu.gif","null","http://www.metroretrofurniture.com/images/desc.gif","null","http://www.metroretrofurniture.com/images/dimen.gif","null","http://www.metroretrofurniture.com/images/ship.gif","null","http://www.metroretrofurniture.com/images/cond.gif","null"
"6 1/2Ft Vintage Florence Knoll Red Mahogany Credenza","MR4580","http://www.metroretrofurniture.com/images/desc.gif","null","http://www.metroretrofurniture.com/images/ship.gif","null","","null","","null","","null"
