product,MR_id,field-1-label-src,field-1-value,field-2-label-src,field-2-value,field-3-label-src,field-3-value,field-4-label-src,field-4-value,field-5-label-src,field-5-value
"San Francisco Earthquake 1906 Unpublished Photograph","MR4487","http://www.metroretrofurniture.com/images/desc.gif","null","http://www.metroretrofurniture.com/images/dimen.gif","null","http://www.metroretrofurniture.com/images/ship.gif","null","http://www.metroretrofurniture.com/images/cond.gif","null","","null"
"SOLD Vintage Persian Bakhtiari Rug 9 x 7","MR4712","","null","","null","","null","","null","","null"
"Knoll Charles Pollock Swivel Arm Chair (15)","MR4327","http://www.metroretrofurniture.com/images/manu.gif","null","http://www.metroretrofurniture.com/images/desi.gif","null","http://www.metroretrofurniture.com/images/desc.gif","null","http://www.metroretrofurniture.com/images/dimen.gif","null","http://www.metroretrofurniture.com/images/ship.gif","null"
"Vintage Paul McCobb Planner Group Widdicomb Tea Cart","MR4559","http://www.metroretrofurniture.com/images/desc.gif","null","http://www.metroretrofurniture.com/images/ship.gif","null","","null","","null","","null"
"Knoll Paul Aferiat Peter Stamberg Salsa Settee & Chair","MR4003","http://www.metroretrofurniture.com/images/pictures/manufac.jpg","Knoll International","http://www.metroretrofurniture.com/images/pictures/designer.jpg","Paul Aferiat 
Paul Aferiat attended Carnegie Mellon University, where he received his Bachelor of Architecture in 1975. He began his architectural training in the offices of Hardy Holzman Pfeiffer and Giorgio Cavalieri. He later worked in the offices of Richard Meier and Partners Architects, on projects that included the Suarez Apartment, the Aye Simon Reading Room in the Guggenheim Museum and the Hartford Seminary Foundation. In the office of Gwathmey Siegel and Associates he was the associate in charge of the American Museum of the Moving Image in Astoria, New York, Westover School in Middlebury, Connecticut, and other commercial and residential projects. 

Peter Stamberg 
Peter Stamberg attended Columbia University, Rhode Island School of Design and the Architectural Association of London Graduate School of Architecture. He began his architectural training in the offices of Davis Brody and Associates. He has written two books and has authored and been the subject of many magazine articles. His Cardinal Dotts chair is in the Contemporary Design Archive of the Cooper-Hewitt National Design Museum in New York.","http://www.metroretrofurniture.com/images/pictures/descript.jpg","Knoll Paul Aferiat Peter Stamberg Salsa Settee & Salsa Lounge Chair","http://www.metroretrofurniture.com/images/pictures/dims.jpg","Settee> 60"" Width x 30"" Depth x 29""Height
Seat Height16.75""Lounge Chair without shelves> 31"" Width x 30"" Depth x 29"" HeigthShelves 8"" Width x 30"" Depth","http://www.metroretrofurniture.com/images/pictures/condit.jpg","Very Good ConditionAge appropriate wear"
"Antique Chinese Embroidered Jacket","MR4919","http://www.metroretrofurniture.com/images/pictures/descript.jpg","Antique Chinese Jacket 

Displayed on a custom made stand 
3 tier black lacquered wood pedestal 

Cotton fabric embroidered with traditional symbols 
Has metal frog closures","http://www.metroretrofurniture.com/images/pictures/dims.jpg","Jacket measures: 44"" Width x 36"" Height","http://www.metroretrofurniture.com/images/pictures/condit.jpg","Very Good Condition","http://www.metroretrofurniture.com/images/pictures/shipp.jpg","","","null"
"Contemporary Drafting Chair Gray","MR4180","","null","","null","","null","","null","","null"
"Vintage Herman Miller George Nelson 1950s Desk Credenza","MR4962","http://www.metroretrofurniture.com/images/pictures/manufac.jpg","Herman Miller","http://www.metroretrofurniture.com/images/pictures/designer.jpg","George Nelson

George Nelson (1908-1986) was an important modernist whose work cut across the fields of interior, industrial and exhibition design. Nelson studied architecture at Yale University in the 1920s, and in the next two decades earned a strong reputation as a writer on design for Architectural Forum, Interiors and Fortune.

In 1945 Nelson began a long association with the Herman Miller Furniture Company of Zeeland, Michigan, where as head designer he developed an innovative line of furniture and commissioned new designs from others. His first commission was Isamu Noguchi`s biomorphic glass-topped coffee table, which began production in 1947, the first of many designs that the sculptor would create for Herman Miller in the late Forties. Nelson also was responsible for bringing the designs of Charles Eames to Herman Miller, and he collaborated with R. Buckminster Fuller on a number of projects. 

Among Nelson`s own creations are classic works of Fifties design, including the bubble lamp, ball clock, marshmallow sofa and the pole-supported wall-storage system. Nelson also designed numerous exhibitions, including the 1959 American National Exhibition in Moscow, and the Chrysler Corporation display at the 1964 New York World`s Fair.","http://www.metroretrofurniture.com/images/pictures/descript.jpg","George Nelson","http://www.metroretrofurniture.com/images/pictures/dims.jpg","Credenza: 69"" L x 18.5"" W x 25.75"" H","http://www.metroretrofurniture.com/images/pictures/condit.jpg","Very Good Condition"
"Mid Century Modern Steelcase Side Chair Set of Three","MR4476","","null","","null","","null","","null","","null"
"(2) Knoll Vincent Cafiero Green Lounge Chair","MR4035","","null","","null","","null","","null","","null"
"","MR4543","","null","","null","","null","","null","","null"
"Vintage Avocado Robsjohn-Gibbings Gentleman`s Chest","MR4093","","null","","null","","null","","null","","null"
"7ft Florence Knoll Boat Shaped Walnut Wood Dining Table","MR4129","http://www.metroretrofurniture.com/images/pictures/designer.jpg","Florence Knoll
Trained as an architect, Florence Knoll`s own pieces for Knoll are simple, architectural designs that stand the test of time. Her lounge seating, sofas, tables, and storage adapt flawlessly to any environment, with their clean, linear design and incredibly durable, high-quality construction. These pieces are built to last a lifetime - or several lifetimes. Not flashy pieces at all, Knoll said that her own work ""filled in the gaps"" for star pieces by Bertoia and Saarinen, but today we know that they stand in a class all by themselves.","http://www.metroretrofurniture.com/images/pictures/descript.jpg","Boat Shaped Dining Table 
1950s Design 

Model 1587 
Custom size 6`+ table 
Black steel base 
Walnut wood veneer top; rich finish 
Beveled edge","http://www.metroretrofurniture.com/images/pictures/dims.jpg","83.25in. Long x 39.5in. Wide x 29.25in. High","http://www.metroretrofurniture.com/images/pictures/condit.jpg","Very Good Vintage","http://www.metroretrofurniture.com/images/pictures/shipp.jpg","Shipping Options Large Items (or multiples) BLANKET WRAP DELIVERY SERVICEPlease contact us for a licensed Blanket Wrap Shipping delivery service with in house deliveries. States that are serviced are, New York, New Jersey, Connecticut, Massachusetts, Pennsylvania, Maryland, Washington DC, Virginia, Tennessee, Arkansas, Texas, and Louisiana.Prices are listed per Item determined by weight and dimensions prices subject to change.Bookcases $325-$475Club/Lounge Chairs $125-$175Coffee Tables $125-$175Desks/Credenzas $325-$475Dining Size Chairs $65Dining Tables $375-$475Loveseats/Settees $225-$275Sofas $235-$425Multiple Items are discounted to same locationAdditional charges may occur such as Stairs, Glass or Marble items etc.The buyer is responsible for making arrangements directly with the carrier. The carrier determines shipping cost and delivery time.BLANKET WRAP PAYMENTS GO DIRECTLY TO SHIPPING COMPANYOrFORWARD AIR to the terminal nearest you $225(Crated, shipped and insured) Customer is responsible for pick up from terminalFORWARD AIR PAYMENTS GO DIRECTLY TO METRO RETRO ALTERNATE SHIPPING OPTIONS Please call or email for shipping quote Fed Ex, US Mail, Freightquote.com (for best shipping price) Determined by Destination, Quantity, Dimensions, Fuel Cost and Weight of your Purchase Determines Shipping QuotePreparation, Timing and ShipmentPlease Allow 7 to 10 Business Days Plus Shipping Time, Shipping Varies By Location and Shipping Method Chosen.If Item needs restoration additional time will be required(Determined by item or items being refinished or reupholstered) QUOTED FOR U.S. ONLYInternational Shipping  When requesting international shipping rates, please allow Us 3 to 5 Days to QuoteThank you for shopping Metro Retro Furniture for further questions please contact us at 713-473-0000"
"Jasper Walnut Wood Veneer Desk L-Shape Vintage Office","MR4548","http://www.metroretrofurniture.com/images/manu.gif","null","http://www.metroretrofurniture.com/images/desc.gif","null","http://www.metroretrofurniture.com/images/dimen.gif","null","http://www.metroretrofurniture.com/images/ship.gif","null","http://www.metroretrofurniture.com/images/cond.gif","null"
"Vintage Mid Century Metal Steelcase Desk Credenza","MR4987","http://www.metroretrofurniture.com/images/pictures/manufac.jpg","Steelcase","http://www.metroretrofurniture.com/images/pictures/descript.jpg","","http://www.metroretrofurniture.com/images/pictures/dims.jpg","Desk: L60x D36x H29","http://www.metroretrofurniture.com/images/pictures/condit.jpg","Very Good Vintage","http://www.metroretrofurniture.com/images/pictures/shipp.jpg","We recommend crate shipping via ForwardAir to the terminal nearest you."
"Restored Deco Tubular Steel Sofa Indoor Outdoor","MR4668","","null","","null","","null","","null","","null"
"","MR4779","","null","","null","","null","","null","","null"
"Vintage Viking Glass Sculpture Swung Vase Art","MR4834","","null","","null","","null","","null","","null"
"(2) Knoll Vincent Cafiero Rose Lounge Chair","MR4044","","null","","null","","null","","null","","null"
"","MR4708","","null","","null","","null","","null","","null"
"","MR4657","","null","","null","","null","","null","","null"
"","MR4077","","null","","null","","null","","null","","null"
"MidCentury Modern Vintage Abstract Acrylic Painting Art","MR4805","","null","","null","","null","","null","","null"
"4 ft Orange Laminate Low Table Midcentury Modern","MR4358","http://www.metroretrofurniture.com/images/desc.gif","null","http://www.metroretrofurniture.com/images/dimen.gif","null","http://www.metroretrofurniture.com/images/ship.gif","null","http://www.metroretrofurniture.com/images/cond.gif","null","","null"
"Russell Wright Conant Ball American Modern Side Chairs","MR4615","http://www.metroretrofurniture.com/images/manu.gif","null","http://www.metroretrofurniture.com/images/desi.gif","null","http://www.metroretrofurniture.com/images/desc.gif","null","http://www.metroretrofurniture.com/images/dimen.gif","null","http://www.metroretrofurniture.com/images/ship.gif","null"
"Herman Miller Eames Fiberglass Shell BLUE-GRAY","MR4347","http://www.metroretrofurniture.com/images/pictures/manufac.jpg","Herman Miller","http://www.metroretrofurniture.com/images/pictures/designer.jpg","Charles and Ray Eames

Charles and Ray married in 1941 and moved to California where they continued their furniture design work with molding plywood. During the war they were commissioned by the Navy to produce molded plywood splints, stretchers and experimental glider shells. In 1946, Evans Products began producing the Eameses` molded plywood furniture. Their molded plywood chair was called ""the chair of the century"" by the influential architectural critic Esther McCoy. Soon production was taken over by Herman Miller, Inc ., who continues to produce the furniture in the United States to this day. Another company, Vitra International , manufactures the furniture in Europe. The Eameses continued to create new furniture designs into the 1970s.

Examples include the molded plastic or fiberglass chairs from the early 1950s and the famous Lounge Chair and Ottoman from 1956. Sturdy, comfortable and elegant office furniture was created in the 1960s, as well as seating designed for Dulles and O`Hare Airports. This Tandem Sling Seating is still in use in airports around the world today.","http://www.metroretrofurniture.com/images/pictures/descript.jpg","Eames Blue-Gray Fiberglass Side Shell Chair 

1950-1953 Design 

Zenaloy (plastic resin reinforced with fiberglass) shell 
Universal base; 4-star cast-aluminum caster base 

We have many Eames Fiberglass Shells in a varity of colors.","http://www.metroretrofurniture.com/images/pictures/dims.jpg","18.5 inch Wide x 22 inch Deep x 31 3/8 inch High
Seat Height-18 inches","http://www.metroretrofurniture.com/images/pictures/condit.jpg","Good Vintage Condition"
"Pair of Knoll Style New Black Leather Lounge Chairs","MR4232","http://www.metroretrofurniture.com/images/desc.gif","null","http://www.metroretrofurniture.com/images/dimen.gif","null","http://www.metroretrofurniture.com/images/ship.gif","null","http://www.metroretrofurniture.com/images/cond.gif","null","","null"
"Early Edition Herman Miller Eames Lounge Chair  and Ottoman","MR4338","http://www.metroretrofurniture.com/cgi-bin/%60http://www.metroretrofurniture.com/images/manu.gif%60","null","http://www.metroretrofurniture.com/cgi-bin/%60http://www.metroretrofurniture.com/images/desi.gif%60","null","http://www.metroretrofurniture.com/cgi-bin/%60http://www.metroretrofurniture.com/images/desc.gif%60","null","http://www.metroretrofurniture.com/cgi-bin/%60http://www.metroretrofurniture.com/images/dimen.gif%60","null","http://www.metroretrofurniture.com/cgi-bin/%60http://www.metroretrofurniture.com/images/ship.gif%60","null"
"Scandinavian Walnut Wood Conference Table","MR4856","","null","","null","","null","","null","","null"
"Widdicomb Robsjohn-Gibbings Dresser Bleach Walnut Wood","MR4608","http://www.metroretrofurniture.com/images/manu.gif","null","http://www.metroretrofurniture.com/images/desi.gif","null","http://www.metroretrofurniture.com/images/desc.gif","null","http://www.metroretrofurniture.com/images/dimen.gif","null","http://www.metroretrofurniture.com/images/ship.gif","null"
"Vintage 1950s 3 Piece Boomerang Desk Credenza Bookcase","MR4074","","null","","null","","null","","null","","null"
"Restored Mid Century Dunbar Style Barrel Chair","MR4578","http://www.metroretrofurniture.com/images/desc.gif","null","http://www.metroretrofurniture.com/images/ship.gif","null","","null","","null","","null"
"SOLD Refinished Alma Walnut Chrome Credenza","MR4704","","null","","null","","null","","null","","null"
"Vintage Herman Miller Eames Fiberglass Rocker","MR4950","http://www.metroretrofurniture.com/images/pictures/manufac.jpg","Herman Miller","http://www.metroretrofurniture.com/images/pictures/designer.jpg","Charles & Ray Eames

Charles and Ray married in 1941 and moved to California where they continued their furniture design work with molding plywood. During the war they were commissioned by the Navy to produce molded plywood splints, stretchers and experimental glider shells. In 1946, Evans Products began producing the Eameses` molded plywood furniture. Their molded plywood chair was called ""the chair of the century"" by the influential architectural critic Esther McCoy. Soon production was taken over by Herman Miller, Inc ., who continues to produce the furniture in the United States to this day. Another company, Vitra International , manufactures the furniture in Europe. The Eameses continued to create new furniture designs into the 1970s.

Examples include the molded plastic or fiberglass chairs from the early 1950s and the famous Lounge Chair and Ottoman from 1956. Sturdy, comfortable and elegant office furniture was created in the 1960s, as well as seating designed for Dulles and O`Hare Airports. This Tandem Sling Seating is still in use in airports around the world today.","http://www.metroretrofurniture.com/images/pictures/descript.jpg","1950s ORIGINAL EAMES ROCKER
DESIGNED BY CHARLES AND RAY EAMES
FOR HERMAN MILLER 
 DARK GREEN SHELL ON BASE BY LICENSED HERMAN MILLER REPRESENTATIVE-MODERNICADATING FROM 1950sSHELL HAS DEEP SHINE AND LOADS OF BEAUTIFUL THICK WHITE FIBRES WITH NO CHIPS OR SCRATCHES. SHOCK MOUNTS IN EXCELLENT CONDITION. HERMAN MILLER LOGO EMBOSSED UNDERNEATH.
THE BASE IS BRAND NEW AND HIGH QUALITY REPRODUCTION WITH SOLID WOOD RUNNERS FANTASTIC CONDITION WITH ONLY THE MINIMAL OF WEAR","http://www.metroretrofurniture.com/images/pictures/dims.jpg","16.5 x W25 x D23","http://www.metroretrofurniture.com/images/pictures/condit.jpg","Excellent"
"Sold Restored Town & Country Lounge Daybed 2 Available","MR4598","http://www.metroretrofurniture.com/images/desc.gif","null","http://www.metroretrofurniture.com/images/ship.gif","null","","null","","null","","null"
"Leather Center Carrera Armless Lounge Tan","MR4760","","null","","null","","null","","null","","null"
"Contemporary Modern Household Serving Tray","MR4667","","null","","null","","null","","null","","null"
"","MR4912","","null","","null","","null","","null","","null"
"Burke Furniture Side Shell Chair","MR4320","http://www.metroretrofurniture.com/cgi-bin/%60http://www.metroretrofurniture.com/images/manu.gif%60","null","http://www.metroretrofurniture.com/cgi-bin/%60http://www.metroretrofurniture.com/images/desc.gif%60","null","http://www.metroretrofurniture.com/cgi-bin/%60http://www.metroretrofurniture.com/images/dimen.gif%60","null","http://www.metroretrofurniture.com/cgi-bin/%60http://www.metroretrofurniture.com/images/ship.gif%60","null","http://www.metroretrofurniture.com/cgi-bin/%60http://www.metroretrofurniture.com/images/cond.gif%60","null"
"Mid Century Modern Pair Metal Bar Stools","MR4736","http://www.metroretrofurniture.com/images/pictures/descript.jpg","Mid-Century Modern Bar Stools","http://www.metroretrofurniture.com/images/pictures/dims.jpg","18.5"" Width x 16.25"" Depth x 36"" Height","http://www.metroretrofurniture.com/images/pictures/condit.jpg","Good Vintage Condition","http://www.metroretrofurniture.com/images/pictures/shipp.jpg","We recommend shipping via DHL or BAX Global to your doorPrice is quoted by Destination, Quantity, Dimensions and Weight of your Purchase
QUOTED FOR U.S. ONLY","","null"
"Orginal  Alexander Girard Chair Ottoman Herman Miller","MR4053","","null","","null","","null","","null","","null"
"","MR4581","","null","","null","","null","","null","","null"
"Pair of 2 Vintage Black Metal Art/Bar Stools","MR4098","","null","","null","","null","","null","","null"
"","MR4935","","null","","null","","null","","null","","null"
"","MR4151","","null","","null","","null","","null","","null"
"Mid Century Danish Leather Lounge Chair 5-star Base","MR4645","","null","","null","","null","","null","","null"
"Mid Century Molenti Italian Walnut Bed with End Tables","MR4890","http://www.metroretrofurniture.com/images/pictures/descript.jpg","Molenti Walnut Bed","http://www.metroretrofurniture.com/images/pictures/dims.jpg","118""L x 39""W x 22""H - Headboard only; with 6.5"" thick cushions","http://www.metroretrofurniture.com/images/pictures/condit.jpg","Very Good Condition - Minor surface scratches on the legs located at the bottom; none distracting.  The fabric is also in very good condition.","http://www.metroretrofurniture.com/images/pictures/shipp.jpg","We recommend crate shipping via ForwardAir to the terminal nearest you for approximately $400.","","null"
"Mid Century Zographos Stainless Steel Base Sidetable","MR4967","http://www.metroretrofurniture.com/images/pictures/manufac.jpg","Zographos","http://www.metroretrofurniture.com/images/pictures/designer.jpg","Zographos","http://www.metroretrofurniture.com/images/pictures/descript.jpg","","http://www.metroretrofurniture.com/images/pictures/dims.jpg","Dia. 24x H18","http://www.metroretrofurniture.com/images/pictures/condit.jpg","Mint"
"10` Versteel Performance Laminate Conference Table","MR4415","http://www.metroretrofurniture.com/images/manu.gif","null","http://www.metroretrofurniture.com/images/desc.gif","null","http://www.metroretrofurniture.com/images/dimen.gif","null","http://www.metroretrofurniture.com/cgi-bin/%60http://www.metroretrofurniture.com/images/ship.gif%60","null","http://www.metroretrofurniture.com/images/cond.gif","null"
"","MR4821","","null","","null","","null","","null","","null"
"Mid Century Tapered 4 Leg Wood Base Tuffet","MR4362","http://www.metroretrofurniture.com/images/desc.gif","null","http://www.metroretrofurniture.com/images/dimen.gif","null","http://www.metroretrofurniture.com/images/ship.gif","null","http://www.metroretrofurniture.com/images/cond.gif","null","","null"
"8` Wood Laminate Conference Table","MR4418","http://www.metroretrofurniture.com/images/desc.gif","null","http://www.metroretrofurniture.com/images/dimen.gif","null","http://www.metroretrofurniture.com/images/ship.gif","null","http://www.metroretrofurniture.com/images/cond.gif","null","","null"
"4ft Vintage Metal Retro Child Student Teacher Desk Pink","MR4599","http://www.metroretrofurniture.com/images/pictures/descript.jpg","Retro Modern Pink & Tan Metal Desk 

Powder coated metal 
Light laminate top with specks & wood edge 

~Features~
(1) Standard drawer 
(1) file drawer 
(1) center pull-out drawer 
Aluminum Handles & Modesty Panel 

Great for Children or Small Spaces","http://www.metroretrofurniture.com/images/pictures/dims.jpg","48"" Length x 29.75"" Width x 29"" Height","http://www.metroretrofurniture.com/images/pictures/condit.jpg","Good Vintage Condition","http://www.metroretrofurniture.com/images/pictures/shipp.jpg","Shipping Terms Small ItemsRecommended shipping via DHL (130 girth) or BAX Global to your doorDestination, Quantity, Dimensions, Fuel Cost and Weight of your Purchase Determine Shipping QuoteWhen buying from ebay please do not use automatic calculated shipping Large Items (or multiples)Recommended shipping via BAX Global to your doorDestination, Quantity, Dimensions, Fuel Cost and Weight of your Purchase Determine Shipping QuoteWhen buying from ebay please do not use automatic calculated shipping Alternate Shipping Large Items (or multiples)Recommended Shipping via Blanket Wrap ShippingThe buyer is responsible for making arrangements directly with the carrier. The carrier determines shipping cost and time.OrRecommended shipping via Forward Air to the terminal nearest you (Crated, shipped and insured) Customer is responsible for pick up from terminalDestination, Quantity, Dimensions, Fuel Cost and Weight of your Purchase Determine Shipping Quote Preparation, Timing and Shipment Please Allow 7 to 10 Business Days Plus Shipping Time, Shipping Varies By Location and Shipping Method Chosen.If Item needs restoration additional time will be required(Determined by item or items being refinished or reupholstered)  Thank you for shopping Metro Retro Furniture for further questions please contact us at 713-473-0000QUOTED FOR U.S. ONLY International ShippingWhen requesting international shipping rates, please allow Us 3 to 5 Days to Quote","","null"
"sold Set of 3 Danish Rosewood Cube Side End Tables","MR4623","http://www.metroretrofurniture.com/images/desc.gif","null","http://www.metroretrofurniture.com/images/dimen.gif","null","http://www.metroretrofurniture.com/images/ship.gif","null","http://www.metroretrofurniture.com/images/cond.gif","null","","null"
"sold 2/27/08 1906 San Francisco Earthquake Unpublished Photograph","MR4482","http://www.metroretrofurniture.com/images/desc.gif","null","http://www.metroretrofurniture.com/images/dimen.gif","null","http://www.metroretrofurniture.com/images/ship.gif","null","http://www.metroretrofurniture.com/images/cond.gif","null","","null"
"","MR4263","","null","","null","","null","","null","","null"
"Signed Framed Tom Kilty River Photograph Enron","MR4948","http://www.metroretrofurniture.com/images/pictures/descript.jpg","Tom Kilty 
Photograph","http://www.metroretrofurniture.com/images/pictures/dims.jpg","16"" x 22.5""","http://www.metroretrofurniture.com/images/pictures/condit.jpg","Very Good Condition","http://www.metroretrofurniture.com/images/pictures/shipp.jpg","We recommend shipping via DHL for $30","","null"
"","MR4253","","null","","null","","null","","null","","null"
"Vintage Saarinen Style Maple Dining Table","MR4293","http://www.metroretrofurniture.com/images/desi.gif","null","http://www.metroretrofurniture.com/images/desc.gif","null","http://www.metroretrofurniture.com/images/dimen.gif","null","http://www.metroretrofurniture.com/images/ship.gif","null","http://www.metroretrofurniture.com/images/cond.gif","null"
"Thonet Marcel Breuer Arm Chairs Set (4)","MR4222","http://www.metroretrofurniture.com/cgi-bin/%60http://www.metroretrofurniture.com/images/manu.gif%60","null","http://www.metroretrofurniture.com/cgi-bin/%60http://www.metroretrofurniture.com/images/desi.gif%60","null","http://www.metroretrofurniture.com/cgi-bin/%60http://www.metroretrofurniture.com/images/desc.gif%60","null","http://www.metroretrofurniture.com/cgi-bin/%60http://www.metroretrofurniture.com/images/dimen.gif%60","null","http://www.metroretrofurniture.com/cgi-bin/%60http://www.metroretrofurniture.com/images/ship.gif%60","null"
"","MR4792","","null","","null","","null","","null","","null"
"Framed Signed Alexander Calder Lithograph ""Sunburst""","MR4675","","null","","null","","null","","null","","null"
"sold 12ft Helikon Burl Wood Conference Table","MR4108","","null","","null","","null","","null","","null"
"","MR4198","","null","","null","","null","","null","","null"
"Mid Century Modern Italian Table Base","MR4678","","description","","null","","null","","null","","null"
