product,MR_id,field-1-label-src,field-1-value,field-2-label-src,field-2-value,field-3-label-src,field-3-value,field-4-label-src,field-4-value,field-5-label-src,field-5-value
"Edward Wormley Blonde Mahogany Dresser","MR4607","http://www.metroretrofurniture.com/images/pictures/manufac.jpg","Drexel","http://www.metroretrofurniture.com/images/pictures/designer.jpg","Edward Wormley

Wormley has pioneered in a broad field of design; he was one of those unique designers who were sensitive to the interplay involved in selling modernism and still preserving the nostalgic touch of intimacy, warmth and detail. Wormley attended the Art Institute of Chicago in 1926. After attending there he worked for Marshall Field’s Design Studio in 1930, and then a year later he began working for Dunbar. His collaboration with Dunbar made him a household name for decades. 

His first Dunbar chairs, produced in 1932, were reproductions of antique designs, but when they became popular Wormley augmented the set with new pieces to form a full line of furniture for almost every room in the house. He was given a contract under which he would produce two lines of furniture each year, one traditional and one modern. By 1944, however, the popularity of the modern line had eclipsed its counterpart and the traditional series was dropped. He opened his own office in New York a year later where he remained a consultant for Dunbar and contracted out his own designs. Wormley`s designs became a special mark of distinction and one can see the great care put into preserving the old with the new.","http://www.metroretrofurniture.com/images/pictures/descript.jpg","Restored Drexel Wormley Precedent Mahogany Dresser","http://www.metroretrofurniture.com/images/pictures/dims.jpg","39"" Width/Length x 19"" Depth x 32.5"" Height","http://www.metroretrofurniture.com/images/pictures/condit.jpg","Very Good Vintage>Refinished"
"sold Mid Century Modern Charleston Molded Fiberglass Chair","MR4795","","null","","null","","null","","null","","null"
"Midcentury Modern Walnut Low Table","MR4442","http://www.metroretrofurniture.com/images/desc.gif","null","http://www.metroretrofurniture.com/images/dimen.gif","null","http://www.metroretrofurniture.com/images/ship.gif","null","http://www.metroretrofurniture.com/images/cond.gif","null","","null"
"Vintage Castelli Piretti Student School Desk","MR4719","http://www.metroretrofurniture.com/images/pictures/manufac.jpg","Castelli","http://www.metroretrofurniture.com/images/pictures/designer.jpg","Giancarlo Piretti","http://www.metroretrofurniture.com/images/pictures/descript.jpg","Piretti Student Desk Chair","http://www.metroretrofurniture.com/images/pictures/dims.jpg","28""W x 24""D x 31""H","http://www.metroretrofurniture.com/images/pictures/condit.jpg","Very Good Vintage Condition"
"","MR4871","","null","","null","","null","","null","","null"
"sold Mid Century Burke Furniture Crimson Side Shell Chair","MR4467","http://www.metroretrofurniture.com/images/manu.gif","null","http://www.metroretrofurniture.com/images/desc.gif","null","http://www.metroretrofurniture.com/images/dimen.gif","null","http://www.metroretrofurniture.com/images/ship.gif","null","http://www.metroretrofurniture.com/images/cond.gif","null"
"","MR4655","","null","","null","","null","","null","","null"
"Eames Herman Miller Time & Life Executive Black Leather Chair","MR4716","http://www.metroretrofurniture.com/images/pictures/manufac.jpg","Herman Miller","http://www.metroretrofurniture.com/images/pictures/descript.jpg","Time & Life 
Executive  Desk Chair 

1960 Charles & Ray Eames Design","http://www.metroretrofurniture.com/images/pictures/dims.jpg","29""W x 19.5""D x 37""H (max)","http://www.metroretrofurniture.com/images/pictures/condit.jpg","Good Vintage Condition; minor scuffs and ware on seat and back","http://www.metroretrofurniture.com/images/pictures/shipp.jpg","We recommend flat rate shipping via UPS for $65 per chair."
"5` Mid Century Modern Dunbar Rosewood Table","MR4965","http://www.metroretrofurniture.com/images/pictures/manufac.jpg","Dunbar","http://www.metroretrofurniture.com/images/pictures/descript.jpg","The rich rosewood desk gives the piece a stately executive look.","http://www.metroretrofurniture.com/images/pictures/dims.jpg","L60x W30x H29","http://www.metroretrofurniture.com/images/pictures/condit.jpg","Mint","http://www.metroretrofurniture.com/images/pictures/shipp.jpg","We recommend crate shipping via ForwardAir to the terminal nearest you."
"Knoll New Black Leather Polished Chrome Bench","MR4252","http://www.metroretrofurniture.com/images/manu.gif","null","http://www.metroretrofurniture.com/images/desi.gif","null","http://www.metroretrofurniture.com/images/desc.gif","null","http://www.metroretrofurniture.com/images/dimen.gif","null","http://www.metroretrofurniture.com/images/ship.gif","null"
"Zographos Sixty-Six Stainless Steel Side Dining Chair","MR4691","","null","","null","","null","","null","","null"
"Chrome Gunther Eberle Vecta Magazine Rack","MR4051","","null","","null","","null","","null","","null"
"","MR4238","","null","","null","","null","","null","","null"
"","MR4319","","null","","null","","null","","null","","null"
"Walnut Six Storage Filing Credenza Chrome Legs","MR4584","http://www.metroretrofurniture.com/images/desc.gif","null","http://www.metroretrofurniture.com/images/dimen.gif","null","http://www.metroretrofurniture.com/images/ship.gif","null","http://www.metroretrofurniture.com/images/cond.gif","null","","null"
"Mint Vintage Kroehler Side Table","MR4837","","null","","null","","null","","null","","null"
"sold Vintage Kittinger Mahogany Brass Corner ""L"" Shaped Desk","MR4698","","We recommend  Blanket Wrap Shipping","","null","","null","","null","","null"
"Type III Fabrics","MR4148","","null","","null","","null","","null","","null"
"","MR4423","","null","","null","","null","","null","","null"
"42"" Knoll Warren Platner Glass Low Table","MR4406","http://www.metroretrofurniture.com/images/manu.gif","null","http://www.metroretrofurniture.com/images/desi.gif","null","http://www.metroretrofurniture.com/images/desc.gif","null","http://www.metroretrofurniture.com/images/dimen.gif","null","http://www.metroretrofurniture.com/images/ship.gif","null"
"Vintage  Stow Davis Teak Credenza and Office Desk Set","MR4116","","null","","null","","null","","null","","null"
"Mid Century Modern Enron Glass Coffee Occasional Table","MR4783","","null","","null","","null","","null","","null"
"Custom Modern Design King Bed/bedding contemporary","MR4720","","null","","null","","null","","null","","null"
"Mid Century Modern Retro Love Seat Couch Lounge","MR4477","http://www.metroretrofurniture.com/images/pictures/descript.jpg","Mid Century Modern Retro Love Seat Couch 

Curved back design.
Wood frame and legs. 
Fully upholstered seat and back in a metallic light blue fabric.
Tufted with matching buttons.
Variation in color due to lighting conditions.
The first three pictures best represent the actual color.","http://www.metroretrofurniture.com/images/pictures/dims.jpg","47"" Width X 34"" Depth X 31"" Height 
17"" Seat Height","http://www.metroretrofurniture.com/images/pictures/condit.jpg","Very Good Vinatge This love seat is missing (3) buttons and can be replaced for an additional $60Or Can be reupholstered for an additional $350 with COM (custumer`s own material)","http://www.metroretrofurniture.com/images/pictures/shipp.jpg","Shipping Terms Small ItemsRecommended shipping via DHL (130 girth) or BAX Global to your doorDestination, Quantity, Dimensions, Fuel Cost and Weight of your Purchase Determine Shipping QuoteWhen buying from ebay please do not use automatic calculated shipping Large Items (or multiples)Recommended shipping via BAX Global to your doorDestination, Quantity, Dimensions, Fuel Cost and Weight of your Purchase Determine Shipping QuoteWhen buying from ebay please do not use automatic calculated shipping Alternate Shipping Large Items (or multiples)Recommended Shipping via Blanket Wrap ShippingThe buyer is responsible for making arrangements directly with the carrier. The carrier determines shipping cost and time.OrRecommended shipping via Forward Air to the terminal nearest you (Crated, shipped and insured) Customer is responsible for pick up from terminalDestination, Quantity, Dimensions, Fuel Cost and Weight of your Purchase Determine Shipping Quote Preparation, Timing and Shipment Please Allow 7 to 10 Business Days Plus Shipping Time, Shipping Varies By Location and Shipping Method Chosen.If Item needs restoration additional time will be required(Determined by item or items being refinished or reupholstered) QUOTED FOR U.S. ONLYWhen Ordering Out Of U.S. Please Give Us 3 to 5 Days on Shipping Quote Thank you for shopping Metro Retro Furniture for further questions please contact us at 713-473-0000","","null"
"","MR4812","","null","","null","","null","","null","","null"
"14ft Mahogany Boat-Shape Conference Table","MR4090","","null","","null","","null","","null","","null"
"","MR4659","","null","","null","","null","","null","","null"
"Vecta Leather Management Chair 4-Star Base","MR4619","http://www.metroretrofurniture.com/images/desc.gif","null","http://www.metroretrofurniture.com/images/ship.gif","null","","null","","null","","null"
"","MR4934","","null","","null","","null","","null","","null"
"George Nelson Herman Miller Walnut Credenza","MR4060","http://www.metroretrofurniture.com/images/pictures/manufac.jpg","Herman Miller","http://www.metroretrofurniture.com/images/pictures/designer.jpg","George Nelson

George Nelson (1908-1986) was an important modernist whose work cut across the fields of interior, industrial and exhibition design. Nelson studied architecture at Yale University in the 1920s, and in the next two decades earned a strong reputation as a writer on design for Architectural Forum, Interiors and Fortune.

In 1945 Nelson began a long association with the Herman Miller Furniture Company of Zeeland, Michigan, where as head designer he developed an innovative line of furniture and commissioned new designs from others. His first commission was Isamu Noguchi`s biomorphic glass-topped coffee table, which began production in 1947, the first of many designs that the sculptor would create for Herman Miller in the late Forties. Nelson also was responsible for bringing the designs of Charles Eames to Herman Miller, and he collaborated with R. Buckminster Fuller on a number of projects. 

Among Nelson`s own creations are classic works of Fifties design, including the bubble lamp, ball clock, marshmallow sofa and the pole-supported wall-storage system. Nelson also designed numerous exhibitions, including the 1959 American National Exhibition in Moscow, and the Chrysler Corporation display at the 1964 New York World`s Fair.","http://www.metroretrofurniture.com/images/pictures/descript.jpg","George Nelson Credenza","http://www.metroretrofurniture.com/images/pictures/dims.jpg","74.5"" Length/ Width x 18.75"" Depth x 27"" Height","http://www.metroretrofurniture.com/images/pictures/condit.jpg","Wood> Excellent refinished"
"14ft Mahogany Rectangular Conference Table","MR4230","http://www.metroretrofurniture.com/images/desc.gif","null","http://www.metroretrofurniture.com/images/dimen.gif","null","http://www.metroretrofurniture.com/images/ship.gif","null","http://www.metroretrofurniture.com/images/cond.gif","null","","null"
"Mid Century Restored Saarinen Style Stool Eames Era","MR4695","","null","","null","","null","","null","","null"
"Mid Century Modern Heywood Wakefield Style End Table","MR4767","","null","","null","","null","","null","","null"
"Framed Signed Alexander Calder Lithograph ""Convection""","MR4674","","null","","null","","null","","null","","null"
"Herman Miller Eames 8ft Walnut Conference Dining Table","MR4387","http://www.metroretrofurniture.com/cgi-bin/%60http://www.metroretrofurniture.com/images/manu.gif%60","null","http://www.metroretrofurniture.com/cgi-bin/%60http://www.metroretrofurniture.com/images/desi.gif%60","null","http://www.metroretrofurniture.com/cgi-bin/%60http://www.metroretrofurniture.com/images/desc.gif%60","null","http://www.metroretrofurniture.com/cgi-bin/%60http://www.metroretrofurniture.com/images/dimen.gif%60","null","http://www.metroretrofurniture.com/cgi-bin/%60http://www.metroretrofurniture.com/images/ship.gif%60","null"
"Vintage Adjustable Chrome Black Swivel Stool","MR4273","","null","http://www.metroretrofurniture.com/images/desc.gif","null","http://www.metroretrofurniture.com/images/dimen.gif","null","http://www.metroretrofurniture.com/images/ship.gif","null","http://www.metroretrofurniture.com/images/cond.gif","null"
"Knoll Mies Van Der Rohe Brown Leather Barcelona Ottoman","MR4206","http://www.metroretrofurniture.com/images/manu.gif","null","http://www.metroretrofurniture.com/images/desi.gif","null","http://www.metroretrofurniture.com/images/desc.gif","null","http://www.metroretrofurniture.com/images/dimen.gif","null","http://www.metroretrofurniture.com/images/ship.gif","null"
"Steelcase End Side Table Casters Mid Century Modern","MR4854","","null","","null","","null","","null","","null"
"sold Midmark Ritter Physician Adjustable Stool Green Vinyl","MR4357","http://www.metroretrofurniture.com/images/manu.gif","null","http://www.metroretrofurniture.com/images/desc.gif","null","http://www.metroretrofurniture.com/images/dimen.gif","null","http://www.metroretrofurniture.com/images/ship.gif","null","http://www.metroretrofurniture.com/images/cond.gif","null"
"5` Round Knoll Maple Bronze Dining Conference Table","MR4460","http://www.metroretrofurniture.com/images/manu.gif","null","http://www.metroretrofurniture.com/images/desi.gif","null","http://www.metroretrofurniture.com/images/desc.gif","null","http://www.metroretrofurniture.com/images/dimen.gif","null","http://www.metroretrofurniture.com/images/ship.gif","null"
"8ft Vintage Rosewood Roger Sprunger Dunbar Dining Table","MR4029","http://www.metroretrofurniture.com/images/pictures/manufac.jpg","DUNBAR","http://www.metroretrofurniture.com/images/pictures/designer.jpg","Roger Srpunger","http://www.metroretrofurniture.com/images/pictures/descript.jpg","Vintage Dunbar Dining Table","http://www.metroretrofurniture.com/images/pictures/dims.jpg","Table> 96"" Length x 48"" Width x 29"" Height","http://www.metroretrofurniture.com/images/pictures/condit.jpg","Very Good Condition"
"","MR4328","","null","","null","","null","","null","","null"
"Herman Miller Eames Side Chair","MR4341","http://www.metroretrofurniture.com/images/manu.gif","null","http://www.metroretrofurniture.com/images/desi.gif","null","http://www.metroretrofurniture.com/images/desc.gif","null","http://www.metroretrofurniture.com/images/dimen.gif","null","http://www.metroretrofurniture.com/images/ship.gif","null"
"American Seating Acton Stacking Chair (100)","MR4343","http://www.metroretrofurniture.com/images/manu.gif","null","http://www.metroretrofurniture.com/images/desi.gif","null","http://www.metroretrofurniture.com/images/desc.gif","null","http://www.metroretrofurniture.com/images/dimen.gif","null","http://www.metroretrofurniture.com/images/ship.gif","null"
"","MR4112","","null","","null","","null","","null","","null"
"Sold Vintage Art Deco Pair(2) Arm Chairs Seating Living Room","MR4907","http://www.metroretrofurniture.com/images/pictures/descript.jpg","PAIR OF ART DECO ARM CHAIRS Exquisite Art Deco side chairs that fold out like white lilies. The soft fabric (high end silk and wool Italian blend) contrast the feel of the wood frame (highly lacquered finish over painted wood) cool in summer and warm to the touch in winter. The single back leg is in the style of Karl Springer`s Onassis chair or Tobia Scarpa for Knoll. The back is split in the middle and shows a brilliant use of negative space.","http://www.metroretrofurniture.com/images/pictures/dims.jpg","26""W x 18.5""D x 29.25""H","http://www.metroretrofurniture.com/images/pictures/condit.jpg","Excellent Condition","http://www.metroretrofurniture.com/images/pictures/shipp.jpg","We recommend crate shipping via ForwardAir to the terminal nearest you for $250","","null"
"Vintage Classic 50s Standard Furniture Credenza","MR4054","","null","","null","","null","","null","","null"
"42"" Round George III Mahogany Burl Dining Table","MR4517","http://www.metroretrofurniture.com/images/pictures/descript.jpg","Mahogany Burl Table 
George III Style 

Mahogany; star burst burl pattern top 
Carved three-star pedestal base 
Features casters with bronze feet 

We have four of these tables available; Price Per Table","http://www.metroretrofurniture.com/images/pictures/dims.jpg","42"" Diameter x 30"" High","http://www.metroretrofurniture.com/images/pictures/condit.jpg","Very Good Condition-Refinished","http://www.metroretrofurniture.com/images/pictures/shipp.jpg","We recommend crate shipping via ForwardAir to the terminal nearest you for $150
QUOTED FOR U.S. ONLY","","null"
"3ft Industrial Vintage GF Barrister Cabinet Bookcase","MR4410","http://www.metroretrofurniture.com/images/pictures/manufac.jpg","GF
General Fireproof","http://www.metroretrofurniture.com/images/pictures/descript.jpg","Industrial Age Vintage GF Barrister Cabinet

~Features~ 
Sealed glass door that can be pushed up and over the books towards the back wall with the use of roller bearings. 

Aluminum knobs 
2 Sections","http://www.metroretrofurniture.com/images/pictures/dims.jpg","36"" Width X 13.50"" Depth X 35"" Height","http://www.metroretrofurniture.com/images/pictures/condit.jpg","Very good vintage","http://www.metroretrofurniture.com/images/pictures/shipp.jpg","Shipping via Forward Air to the terminal nearest youCustomer is responsible for pick up from terminal  QUOTED FOR U.S. ONLY International Shipping  When requesting international shipping rates, please allow Us 3 to 5 Days to Quote Preparation, Timing and Shipment Please Allow 7 to 10 Business Days Plus Shipping Time.If Item needs restoration additional time will be required(Determined by item or items being refinished or reupholstered)  Thank you for shopping Metro Retro Furniture for further questions please contact us at 713-473-0000"
"Vintage White Fiberglass Shell Bar/Drafting Stool","MR4177","","null","","null","","null","","null","","null"
"Midcentury Modern Helikon Marble 48"" Dining Table","MR4399","http://www.metroretrofurniture.com/images/manu.gif","null","http://www.metroretrofurniture.com/images/desc.gif","null","http://www.metroretrofurniture.com/images/dimen.gif","null","http://www.metroretrofurniture.com/images/ship.gif","null","http://www.metroretrofurniture.com/images/cond.gif","null"
"sold Restored Pair of Kinetics Seating Bentwood Steel Chairs","MR4642","http://www.metroretrofurniture.com/images/desc.gif","null","","null","","null","","null","","null"
"Framed Gesture Drawing Lithograph Woman","MR4928","http://www.metroretrofurniture.com/images/pictures/descript.jpg","Lithograph 

Signed (illegibly initialed lower center)","http://www.metroretrofurniture.com/images/pictures/dims.jpg","12.75"" x 9.25"" W","http://www.metroretrofurniture.com/images/pictures/condit.jpg","Very Good Condition","http://www.metroretrofurniture.com/images/pictures/shipp.jpg","We recommend shipping via DHL","","null"
"Stendig Otto Blumel Garmisch Dining Chair","MR4258","http://www.metroretrofurniture.com/images/manu.gif","null","http://www.metroretrofurniture.com/images/desi.gif","null","http://www.metroretrofurniture.com/images/desc.gif","null","http://www.metroretrofurniture.com/images/dimen.gif","null","http://www.metroretrofurniture.com/images/ship.gif","null"
"Vintage Eames Side Shell Chair and Segmented BaseTable Set","MR4310","http://www.metroretrofurniture.com/cgi-bin/%60http://www.metroretrofurniture.com/images/manu.gif%60","null","http://www.metroretrofurniture.com/cgi-bin/%60http://www.metroretrofurniture.com/images/desi.gif%60","null","http://www.metroretrofurniture.com/cgi-bin/%60http://www.metroretrofurniture.com/images/desc.gif%60","null","http://www.metroretrofurniture.com/cgi-bin/%60http://www.metroretrofurniture.com/images/dimen.gif%60","null","http://www.metroretrofurniture.com/cgi-bin/%60http://www.metroretrofurniture.com/images/ship.gif%60","null"
"Vintage Wilkes Herman Miller Chicklet Modular Seating Sofa","MR4722","","null","","null","","null","","null","","null"
"","MR4794","","null","","null","","null","","null","","null"
"Framed 1950`s Vintage Decorative Wall Hanging","MR4625","http://www.metroretrofurniture.com/images/desc.gif","null","http://www.metroretrofurniture.com/images/dimen.gif","null","http://www.metroretrofurniture.com/images/ship.gif","null","http://www.metroretrofurniture.com/images/cond.gif","null","","null"
"Vintage Knoll Pollock Office Chair Original Leather","MR4372","http://www.metroretrofurniture.com/images/pictures/manufac.jpg","Knoll International","http://www.metroretrofurniture.com/images/pictures/designer.jpg","Charles Pollock 
Charles Pollock worked in George Nelson’s office after receiving a bachelor’s degree in industrial design from Pratt Institute. In addition to his work for Knoll, he has designed chairs for Thonet and Castelli. He is also a recipient of many awards including Pratt Institute`s 1991 Excellence by Design Award.","http://www.metroretrofurniture.com/images/pictures/descript.jpg","Knoll Pollock Executive 1258 Side Arm Chair 
1965 Design 

Base> Stainless Steel Cap Over Steel Armature 
Upholstery> Polyurethane and Polyester Thick Tufted Leather over Plastic Shell with Aluminum Waterfall Front Frame Ebonized Arm Rests 

Charles Pollock`s 1965 executive chair, now considered one of Knoll`s most memorable designs, features an aluminum rim that supports the chair both structurally and visually 

Swivel base, does not tilt 
Interchangeable base> casters (carpet or wood) or glides 
Limited supply available, please inquire on options 

This ad is for 1 Pollock chair two chairs available 
Another Pollock chairs available in different colors!!! 

50% OFF 
Original Price Was $350","http://www.metroretrofurniture.com/images/pictures/dims.jpg","26.25"" Width x 27"" Depth x 31"" Height 
Seat Height> 17""","http://www.metroretrofurniture.com/images/pictures/condit.jpg","Good Vintage 
Overall appearance and stability is very good. 
Scratches to shell seat back. 
The chrome has some pitting due to age (picture showing chrome condition not necessarily the same chair) 
Tears and cuts to leather, optional reupholster for $100 + cost of fabric or leather. Customer Supplies Material"
"Florence Knoll Calcata Marble Bronze Base","MR4340","http://www.metroretrofurniture.com/images/manu.gif","null","http://www.metroretrofurniture.com/images/desi.gif","null","http://www.metroretrofurniture.com/images/desc.gif","null","http://www.metroretrofurniture.com/images/dimen.gif","null","http://www.metroretrofurniture.com/images/ship.gif","null"
"Set of 2 Modern Side Chairs","MR4447","http://www.metroretrofurniture.com/images/desc.gif","null","http://www.metroretrofurniture.com/images/dimen.gif","null","http://www.metroretrofurniture.com/images/ship.gif","null","http://www.metroretrofurniture.com/images/cond.gif","null","","null"
"Spanish Bamboo Leather Ceremonial Processional Staff","MR4932","http://www.metroretrofurniture.com/images/pictures/descript.jpg","Spanish Processional Staffs 

Split bamboo rattles and leather bindings 

One with a cross finial 
Another with a round pointed finial","http://www.metroretrofurniture.com/images/pictures/dims.jpg","39"" Height x 5.25"" Width","http://www.metroretrofurniture.com/images/pictures/condit.jpg","Very Good Condition","http://www.metroretrofurniture.com/images/pictures/shipp.jpg","We recommend shipping via DHL","","null"
"4ft Vintage Retro Metal Child Student Teacher Desk","MR4602","http://www.metroretrofurniture.com/images/pictures/descript.jpg","Retro Modern Light Green-Gray Metal Desk 

Powder coated metal 
Light laminate top with specks & wood edge 

Features 

(1) Standard drawer 
(1) file drawer 
(1) center pull-out drawer 
Aluminum Handles & Modesty Panel 

Great for Children or Small Spaces!","http://www.metroretrofurniture.com/images/pictures/dims.jpg","48"" Length x 29.75"" Width x 29"" Height","http://www.metroretrofurniture.com/images/pictures/condit.jpg","Good Vintage Condition","http://www.metroretrofurniture.com/images/pictures/shipp.jpg","We recommend crate shipping via ForwardAir to the terminal nearest you for $200.
QUOTED FOR U.S. ONLY","","null"
"Howard Miller George Nelson Walnut Sunburst Clock","MR4073","","null","","null","","null","","null","","null"
"","MR4938","","null","","null","","null","","null","","null"
"Pair of 2 Fixtures Furniture Stools","MR4100","","null","","null","","null","","null","","null"
